{
  "schemaVersion": 1,
  "id": "0003-margin-collapse",
  "stage": "pilot",
  "family": "block",
  "features": [
    "margin-collapse",
    "nested-block",
    "negative-margin"
  ],
  "seed": 20261003,
  "generatorVersion": "1.0",
  "scriptless": true,
  "states": [
    "initial"
  ],
  "viewports": [
    [
      384,
      768
    ],
    [
      800,
      600
    ],
    [
      1280,
      800
    ]
  ],
  "dpi": [
    96,
    144
  ],
  "htmlSha256": "9033B0C3C1D97B03B5BA78C7EBEA39AD9DAD10FF24118262CF99E25F206C3021",
  "cssSha256": "930DB5858522978387E4261CB0D4E414F944A51148265BD948CC395EF9E9DD61"
}
