{
  "schemaVersion": 1,
  "id": "0005-flex-wrap",
  "stage": "pilot",
  "family": "flex",
  "features": [
    "flex",
    "wrap",
    "align-content",
    "border"
  ],
  "seed": 20261003,
  "generatorVersion": "1.0",
  "scriptless": true,
  "states": [
    "initial"
  ],
  "viewports": [
    [
      384,
      768
    ],
    [
      800,
      600
    ],
    [
      1280,
      800
    ]
  ],
  "dpi": [
    96,
    144
  ],
  "htmlSha256": "C46182E9EFEF0DE58A62F1BDF895412662BAA9DA9780DF4EA4B09726A7044CAC",
  "cssSha256": "57474B11CE6628656083F67F3711D6523B96E33A0477ED1F67B109D0014864C7"
}
