{
  "schemaVersion": 1,
  "id": "0016-responsive-grid",
  "stage": "pilot",
  "family": "responsive",
  "features": [
    "media",
    "grid",
    "flex",
    "viewport-width"
  ],
  "seed": 20261003,
  "generatorVersion": "1.0",
  "scriptless": true,
  "states": [
    "initial"
  ],
  "viewports": [
    [
      384,
      768
    ],
    [
      800,
      600
    ],
    [
      1280,
      800
    ]
  ],
  "dpi": [
    96,
    144
  ],
  "htmlSha256": "CB782303002D4D49546604D326133EE4342257C363557BBC3B05346BA0DD47D8",
  "cssSha256": "D84C4F98572CAD9EC2B52299E15DE0C09FDD648024DE6F75AF7D1CBF04AE5E0A"
}
